{
  "$schema": "https://raw.githubusercontent.com/axonivy-market/market/refs/heads/master/schema/meta.json",
  "id": "persistence-utils",
  "name": "Persistence Utils",
  "names": [
    {
      "locale": "en",
      "value": "Persistence Utils"
    },
    {
      "locale": "de",
      "value": "Persistenz Utilities"
    }
  ],
  "description": "Axon Ivy's Persistence Utility facilitates the automation of processes by introducing a DAO abstraction layer.",
  "descriptions": [
    {
      "locale": "en",
      "value": "Axon Ivy's Persistence Utility facilitates the automation of processes by introducing a DAO abstraction layer."
    },
    {
      "locale": "de",
      "value": "Axon Ivys Persistence Lib Utility erleichtert die Automatisierung von Prozessen durch die Einführung einer DAO-Abstraktionsebene."
    }
  ],
  "type": "utils",
  "platformReview": "4.5",
  "sourceUrl": "https://github.com/axonivy-market/persistence-utils",
  "statusBadgeUrl": "https://github.com/axonivy-market/persistence-utils/actions/workflows/ci.yml/badge.svg",
  "language": "English",
  "industry": "Cross-Industry",
  "tags": ["utils"],
  "mavenArtifacts": [
    {
      "repoUrl": "https://maven.axonivy.com",
      "name": "Persistence Utils Product",
      "groupId": "com.axonivy.utils.persistence",
      "artifactId": "persistence-utils-product",
      "type": "zip"
    }
  ]
}
