{
  "$schema": "https://raw.githubusercontent.com/axonivy-market/market/refs/heads/master/schema/meta.json",
  "id": "deepl-connector",
  "name": "DeepL",
  "names": [
    {
      "locale": "en",
      "value": "DeepL"
    },
    {
      "locale": "de",
      "value": "DeepL"
    }
  ],
  "description": "Easily integrate and manage real-time language translation services within your business processes.",
  "descriptions": [
    {
      "locale": "en",
      "value": "Easily integrate and manage real-time language translation services within your business processes."
    },
    {
      "locale": "de",
      "value": "Einfache Integration und Verwaltung von Übersetzungsdiensten in deinen Geschäftsprozessen."
    }
  ],
  "type": "connector",
  "platformReview": "4.5",
  "sourceUrl": "https://github.com/axonivy-market/deepl-connector",
  "statusBadgeUrl": "https://github.com/axonivy-market/deepl-connector/actions/workflows/ci.yml/badge.svg",
  "language": "English",
  "industry": "Cross-Industry",
  "tags": ["AI"],
  "mavenArtifacts": [
    {
      "repoUrl": "https://maven.axonivy.com",
      "name": "DeepL connector",
      "groupId": "com.axonivy.connector.deepl",
      "artifactId": "deepl-connector-product",
      "type": "zip"
    }
  ]
}
