{
  "$schema": "https://raw.githubusercontent.com/axonivy-market/market/refs/heads/master/schema/meta.json",
  "id": "openai-assistant",
  "name": "ChatGPT Assistant",
  "names": [
    {
      "locale": "en",
      "value": "ChatGPT Assistant"
    },
    {
      "locale": "de",
      "value": "ChatGPT Assistent"
    }
  ],
  "description": "The ChatGPT assistant explains, maintains and extends code for you",
  "descriptions": [
    {
      "locale": "en",
      "value": "The ChatGPT assistant explains, maintains and extends code for you"
    },
    {
      "locale": "de",
      "value": "Der ChatGPT Assistent erklärt und erweitert Axon Ivy Code für Dich."
    }
  ],
  "type": "connector",
  "platformReview": "4.5",
  "sourceUrl": "https://github.com/axonivy-market/openai-connector",
  "statusBadgeUrl": "https://github.com/axonivy-market/openai-connector/actions/workflows/ci.yml/badge.svg",
  "language": "English",
  "industry": "Cross-Industry",
  "tags": ["AI"],
  "mavenArtifacts": [
    {
      "repoUrl": "https://maven.axonivy.com",
      "name": "OpenAI Assistant",
      "groupId": "com.axonivy.connector.openai",
      "artifactId": "openai-assistant-product",
      "type": "zip"
    }
  ]
}
