{
	"id": "metaproc-connector",
	"name": "Axon Ivy RPA",
	"description": "Built-In Robotic Process Automation (RPA)",
	"type": "connector",
	"platformReview": "4.5",
	"sourceUrl": "https://github.com/axonivy-market/metaproc-connector",
	"statusBadgeUrl": "https://github.com/axonivy-market/metaproc-connector/actions/workflows/ci.yml/badge.svg",
	"language": "English",
	"industry": "Cross-Industry",
	"tags": ["RPA"],
	"mavenArtifacts": [
		{
			"repoUrl": "https://maven.axonivy.com",
			"name": "meta:proc Connector Product",
			"groupId": "com.axonivy.connector.metaproc",
			"artifactId": "metaproc-connector-product",
			"type": "zip"
		}
	]
}
