{
  "$schema": "https://raw.githubusercontent.com/axonivy-market/market/refs/heads/master/schema/meta.json",
  "id": "kafka-connector",
  "name": "Apache Kafka",
  "names": [
    {
      "locale": "en",
      "value": "Apache Kafka"
    },
    {
      "locale": "de",
      "value": "Apache Kafka"
    }
  ],
  "description": "API for facilitating distributed event streaming to automate real-time process workflows.",
  "descriptions": [
    {
      "locale": "en",
      "value": "API for facilitating distributed event streaming to automate real-time process workflows."
    },
    {
      "locale": "de",
      "value": "Diese API erleichtert das verteilte Event-Streaming bei der Automatisierung von Echtzeit-Prozess-Workflows."
    }
  ],
  "type": "connector",
  "platformReview": "4.5",
  "sourceUrl": "https://github.com/axonivy-market/kafka-connector",
  "statusBadgeUrl": "https://github.com/axonivy-market/kafka-connector/actions/workflows/ci.yml/badge.svg",
  "language": "English",
  "industry": "Cross-Industry",
  "tags": ["messaging"],
  "mavenArtifacts": [
    {
      "name": "Kafka Connector Product",
      "groupId": "com.axonivy.connector.kafka",
      "artifactId": "kafka-connector-product",
      "type": "zip"
    }
  ]
}
