{
  "$schema": "https://raw.githubusercontent.com/axonivy-market/market/refs/heads/master/schema/meta.json",
  "id": "sproof-connector",
  "name": "Sproof",
  "names": [
    {
      "locale": "en",
      "value": "Sproof"
    },
    {
      "locale": "de",
      "value": "Sproof"
    }
  ],
  "description": "Sproof powers secure, end-to-end digital signature workflows fully integrated with Axon Ivy.",
  "descriptions": [
    {
      "locale": "en",
      "value": "Sproof powers secure, end-to-end digital signature workflows fully integrated with Axon Ivy."
    },
    {
      "locale": "de",
      "value": "Sproof ermöglicht sichere, durchgängige Workflows für digitale Signaturen, die vollständig in Axon Ivy integriert sind."
    }
  ],
  "type": "connector",
  "platformReview": "4",
  "sourceUrl": "https://github.com/axonivy-market/sproof-connector",
  "statusBadgeUrl": "https://github.com/axonivy-market/sproof-connector/actions/workflows/ci.yml/badge.svg",
  "language": "English",
  "industry": "Cross-Industry",
  "tags": ["connector"],
  "mavenArtifacts": [
    {
      "repoUrl": "https://maven.axonivy.com",
      "name": "Sproof Product",
      "artifactId": "sproof-connector-product",
      "groupId": "com.axonivy.connector.sproof",
      "type": "zip"
    }
  ]
}
