{
  "$schema": "https://raw.githubusercontent.com/axonivy-market/market/refs/heads/master/schema/meta.json",
  "id": "threema-connector",
  "name": "Threema",
  "names": [
    {
      "locale": "en",
      "value": "Threema"
    },
    {
      "locale": "de",
      "value": "Threema"
    }
  ],
  "description": "Use the Threema API to send secure messages directly from your business processes.",
  "descriptions": [
    {
      "locale": "en",
      "value": "Use the Threema API to send secure messages directly from your business processes."
    },
    {
      "locale": "de",
      "value": "Verwende die Threema API, um verschlüsselte Nachrichten direkt aus deinen Geschäftsabläufen an diesen Messenger zu senden."
    }
  ],
  "type": "connector",
  "platformReview": "5",
  "sourceUrl": "https://github.com/axonivy-market/threema-connector",
  "statusBadgeUrl": "https://github.com/axonivy-market/threema-connector/actions/workflows/ci.yml/badge.svg",
  "language": "English",
  "industry": "Cross-Industry",
  "tags": ["communication"],
  "mavenArtifacts": [
    {
      "repoUrl": "https://maven.axonivy.com",
      "name": "Threema Connector",
      "groupId": "com.axonivy.connector.threema",
      "artifactId": "threema-connector-product",
      "type": "zip"
    }
  ]
}
