{
  "$schema": "https://raw.githubusercontent.com/axonivy-market/market/refs/heads/master/schema/meta.json",
  "id": "coffee-machine-connector",
  "name": "Coffee Machine",
  "names": [
    {
      "locale": "en",
      "value": "Coffee Machine"
    },
    {
      "locale": "de",
      "value": "Coffee Machine"
    }
  ],
  "description": "This connector is part of our Onboarding Tutorial, which shows you how to use the Axon Ivy Designer.",
  "descriptions": [
    {
      "locale": "en",
      "value": "This connector is part of our Onboarding Tutorial, which shows you how to use the Axon Ivy Designer."
    },
    {
      "locale": "de",
      "value": "Dieser Connector ist Teil unseres Onboarding-Tutorials, das Ihnen zeigt, wie Sie den Axon Ivy Designer verwenden."
    }
  ],
  "type": "connector",
  "platformReview": "4.5",
  "sourceUrl": "https://github.com/axonivy-market/coffee-machine-connector",
  "statusBadgeUrl": "https://github.com/axonivy-market/coffee-machine-connector/actions/workflows/ci.yml/badge.svg",
  "language": "English",
  "industry": "Cross-Industry",
  "tags": ["tutorial"],
  "mavenArtifacts": [
    {
      "repoUrl": "https://maven.axonivy.com",
      "name": "Coffee Machine Connector",
      "groupId": "com.axonivy.connector.coffeemachine",
      "artifactId": "coffee-machine-connector-product",
      "type": "zip"
    }
  ]
}
