{
  "$schema": "https://raw.githubusercontent.com/axonivy-market/market/refs/heads/master/schema/meta.json",
  "id": "custom-mail-demo",
  "name": "Custom Mail Feature",
  "names": [
    {
      "locale": "en",
      "value": "Custom Mail Feature"
    },
    {
      "locale": "de",
      "value": "Standard Email"
    }
  ],
  "description": "Customize Axon Ivy standard mail notification using your own processes.",
  "descriptions": [
    {
      "locale": "en",
      "value": "Customize Axon Ivy standard mail notification using your own processes."
    },
    {
      "locale": "de",
      "value": "In dieser Demo wird gezeigt, wie die Standard-Mailbenachrichtigung von Axon Ivy an deine eigenen Prozesse angepasst wird."
    }
  ],
  "type": "utils",
  "platformReview": "4.5",
  "sourceUrl": "https://github.com/axonivy-market/custom-mail-demo",
  "statusBadgeUrl": "https://github.com/axonivy-market/custom-mail-demo/actions/workflows/ci.yml/badge.svg",
  "language": "English",
  "industry": "Cross-Industry",
  "tags": ["utils"],
  "mavenArtifacts": [
    {
      "name": "Custom Mail Demo Product",
      "groupId": "com.axonivy.demo.custom.mail",
      "artifactId": "custom-mail-demo-product",
      "type": "zip"
    }
  ]
}
