{
  "$schema": "https://raw.githubusercontent.com/axonivy-market/market/refs/heads/master/schema/meta.json",
  "id": "sftp-connector",
  "name": "SFTP",
  "names": [
    {
      "locale": "en",
      "value": "SFTP"
    },
    {
      "locale": "de",
      "value": "SFTP"
    }
  ],
  "description": "An SFTP client that securely transfers files to and from a remote computer using the SFTP protocol.",
  "descriptions": [
    {
      "locale": "en",
      "value": "An SFTP client that securely transfers files to and from a remote computer using the SFTP protocol."
    },
    {
      "locale": "de",
      "value": "Ein Client, der Dateien sicher zwischen Deinem lokalen und einem Remote-Computer, mit dem SFTP-Protokoll, überträgt."
    }
  ],
  "type": "connector",
  "platformReview": "4.5",
  "sourceUrl": "https://github.com/axonivy-market/sftp-connector",
  "statusBadgeUrl": "https://github.com/axonivy-market/sftp-connector/actions/workflows/ci.yml/badge.svg",
  "language": "English",
  "industry": "Cross-Industry",
  "tags": ["sftp"],
  "mavenArtifacts": [
    {
      "repoUrl": "https://maven.axonivy.com",
      "name": "SFTP Connector",
      "groupId": "com.axonivy.connector.sftp",
      "artifactId": "sftp-connector-product",
      "type": "zip"
    }
  ]
}
