{
  "$schema": "https://json-schema.axonivy.com/market/10.0.5/meta.json",
  "id": "msgraph-todo",
  "name": "Microsoft To Do",
  "names": [
    {
      "locale": "en",
      "value": "Microsoft To Do"
    },
    {
      "locale": "de",
      "value": "Microsoft To Do"
    }
  ],
  "description": "Organize and track Microsoft To Do task lists directly within your business processes.",
  "descriptions": [
    {
      "locale": "en",
      "value": "Organize and track Microsoft To Do task lists directly within your business processes."
    },
    {
      "locale": "de",
      "value": "Integriere Microsoft To Do mühelos mit deinen Geschäftsprozessen, um Aufgaben zentral zu steuern und nachzuverfolgen."
    }
  ],
  "type": "utils",
  "platformReview": "4.5",
  "sourceUrl": "https://github.com/axonivy-market/msgraph-connector",
  "language": "English",
  "industry": "Cross-Industry",
  "compatibility": "9.4+",
  "tags": ["office"],
  "mavenArtifacts": [
    {
      "repoUrl": "https://maven.axonivy.com",
      "name": "Microsoft ToDo Product",
      "groupId": "com.axonivy.connector.office365",
      "artifactId": "msgraph-todo-product",
      "type": "zip"
    }
  ]
}
