{
  "$schema": "https://raw.githubusercontent.com/axonivy-market/market/refs/heads/master/schema/meta.json",
  "id": "aspose-barcode-demo",
  "name": "Aspose.BarCode Demo",
  "names": [
    {
      "locale": "en",
      "value": "Aspose.BarCode Demo"
    },
    {
      "locale": "de",
      "value": "Aspose.BarCode Demo"
    }
  ],
  "description": "Create, & recognize barcodes of linear and 2D types within any business process.",
  "descriptions": [
    {
      "locale": "en",
      "value": "Create, & recognize barcodes of linear and 2D types within any business process."
    },
    {
      "locale": "de",
      "value": "Integriere die Erstellung und Erkennung von linearen und 2D-Barcodes in deine Geschäftsprozesse."
    }
  ],
  "type": "utils",
  "platformReview": "4.5",
  "sourceUrl": "https://github.com/axonivy-market/doc-factory",
  "statusBadgeUrl": "https://github.com/axonivy-market/doc-factory/actions/workflows/ci.yml/badge.svg",
  "language": "English",
  "industry": "Cross-Industry",
  "tags": ["utils", "barcode", "document generation"],
  "validate": true,
  "mavenArtifacts": [
    {
      "name": "Aspose.Barcode Demo Product",
      "groupId": "com.axonivy.utils.docfactory",
      "artifactId": "aspose-barcode-demo-product",
      "type": "zip"
    }
  ]
}
